id,title,buyer,value,cpvs,stage,published_date,description,source,source_url
032380-2026,SP06026/SCHOOL TRANSPORT/REQUEST FOR QUOTATION/SCARBOROUGH AREA/4 SEATS,The North Yorkshire Council,,,"award, contract",2026-04-09T12:58:14+01:00,"School transport for contract SP06026, Whitby to Scalby School, 4 seats, February 2026 - March 2027",Find a Tender,https://www.find-tender.service.gov.uk/Notice/032380-2026
032379-2026,002554 - Preliminary Market Engagement (PME) for the Provision of an Allotment Management System,Durham County Council,24000,48100000,planning,2026-04-09T12:57:36+01:00,"Durham County Council are seeking to procure an IT system to assist in the management of its portfolio of 170 allotment sites and the 2,200 tenants who occupy the plots on those sites. The system will be used by 5 allotment management staff, 4 allotment maintenance staff, and 4 support staff.
This notice forms part of our preliminary market engagement, offering you the opportunity to share feedback and comments before the opportunity is released for formal tender submissions.
Interested providers can access the written response questions, free of charge, by registering on the Open Portal at www.open-uk.org
The deadline for completed responses is Friday 24th April 2026 at 12 noon.",Find a Tender,https://www.find-tender.service.gov.uk/Notice/032379-2026
032378-2026,UHB - CyberKnife System Maintenance Contract,University Hospitals Birmingham NHS Foundation Trust,,,"award, contract",2026-04-09T12:54:58+01:00,Maintenance Contract for the Cyberknife (Accuray) within Radiotherapy,Find a Tender,https://www.find-tender.service.gov.uk/Notice/032378-2026
032377-2026,Clent Way Main Contractor,GREENSQUAREACCORD LIMITED,,,"award, contract",2026-04-09T12:54:53+01:00,"Demolish Garage Forecourts and Undercroft and replace with 2 new garage areas. Design and Build 12 units, that are made up of 2- and 3-bedroom homes and bungalows that are to be built by MMC.
Tetra Tech is the Employees Agent for this Procurement, and will be helping carry out part of the procurement on behalf of GreenSquareAccord.
The price has been slightly increased since tender award based on the sum on electric and drainage has been firmed up. Also the sum for the demolition and asbestos survey has been increased. Although the price has increased, this doesn't effect the out come of the tender evaluation.",Find a Tender,https://www.find-tender.service.gov.uk/Notice/032377-2026
032376-2026,Stourbridge Main Contractor,GREENSQUAREACCORD LIMITED,,,"award, contract",2026-04-09T12:53:37+01:00,"Demolition of existing building (Mayfield House) and to design and build 22 units, that are made up of 1 bedroom apartments, at the Stourbridge Site.
Walker Cotter is the Employee Agent for this procurement, and will be helping carry out part of the procurement on behalf of GreenSquareAccord.
The price has slightly increased since tender award, based on fixed prices on all risks and firming the provisional sums for the utilities. Although the price has increased, this has not had an effect on the outcome of the evaluation of the tender.",Find a Tender,https://www.find-tender.service.gov.uk/Notice/032376-2026
032375-2026,2425-0609 Integrated Community Drug and Alcohol Service,London Borough of Islington,,85000000,planningUpdate,2026-04-09T12:53:30+01:00,"Social Community Care Supplies & Services - Adult » Alcohol & Drug Rehabilitation | 321020
This notice is a PIPELINE NOTICE and therefore is NOT currently a call for competition. For the avoidance of doubt, the Pipeline Notice is intended to provide the most accurate forecast currently available for the council's high value procurement activity, but does not commit the council to procuring any contract and may be amended after publication.",Find a Tender,https://www.find-tender.service.gov.uk/Notice/032375-2026
032374-2026,Data Architecture,The North Yorkshire Council,,,"award, contract",2026-04-09T12:52:52+01:00,Procurement of Data Architecture,Find a Tender,https://www.find-tender.service.gov.uk/Notice/032374-2026
032373-2026,Legal Services,Waythrough,2250000.0,79100000,planningUpdate,2026-04-09T12:52:30+01:00,Provision of Legal Advisory Services,Find a Tender,https://www.find-tender.service.gov.uk/Notice/032373-2026
032372-2026,NFCC National Firefighter PPE - Lot 7 (Lightweight Firefighting PPE),Kent and Medway Towns Fire and Rescue Authority,,,"award, contract",2026-04-09T12:51:54+01:00,"Kent and Medway Towns Fire and Rescue Authority on behalf of NFCC, as the Contracting Authority, is seeking to establish a series of open Framework Agreements. Each successive open framework will be for specific products and/or services that will be awarded to successful suppliers, pursuant to which the Participating Authorities listed in Annex 1 of the Procurement Specific Questionnaire may award a Call-Off Agreement. 
This Tender Notice relates to 'Lot 7 (Lightweight Firefighting PPE)'. 
The Procurement Specific Questionnaire will be published alongside this Tender Notice. The draft ITT (which will include the draft form of Framework Agreement and draft form of Call-Off Agreement) will include details of the call-off procedure. 
'Lot 7 (Lightweight Firefighting PPE)' relates to the provision of Lightweight Firefighting PPE, as set out within the Specification and Requirement document for this Lot. 
This procurement will start with a participation stage comprising of the completion of the Procurement Specific Questionnaire and the information required to be submitted to the Central Digital Platform by potential bidders. Those successful at the participation stage will progress to the tender stage and will be invited to submit a formal tender in response to the Invitation to Tender (ITT).  The evaluation process for the tender stage will include wearer trials and site visits.  
It is intended that up to 4 successful suppliers will each be awarded a Framework Agreement (subject to the Contracting Authority's discretion to increase the number of successful suppliers beyond 4). Participating Authorities will be able to enter into a Call-Off Agreement under the Framework Agreement following the call-off procedure.  
The Contracting Authority reserves the right to charge a levy to the successful suppliers as set out within the draft ITT. 
Where there is more than 1 successful supplier, it is intended that each Framework Agreement will have a maximum term of 8 years. It is anticipated that the successive frameworks will re-open as follows: in (i) March 2029 and (ii) between March 2032 and March 2033. These dates may be subject to change at the discretion of the Contracting Authority.
Access Code to PSQ : FAJDDJ6886",Find a Tender,https://www.find-tender.service.gov.uk/Notice/032372-2026
032371-2026,Field Operative Management System,WAVERLEY HOUSING,,"48000000, 48100000","award, contract",2026-04-09T12:51:25+01:00,Field operative management system to schedule works orders and allow operative to complete jobs and health and safety compliance on a mobile device whilst out in the field.,Find a Tender,https://www.find-tender.service.gov.uk/Notice/032371-2026
032370-2026,Westgate Road New Build 2026,Dartford Borough Council,,,"award, contract",2026-04-09T12:47:46+01:00,"Construction of new dwellings at Westgate Road, Dartford to include construction of a block of flats and associated housing units.",Find a Tender,https://www.find-tender.service.gov.uk/Notice/032370-2026
032369-2026,IT2283 Foxit PDF Editor,Wiltshire Council,,,"award, contract",2026-04-09T12:44:55+01:00,Purchase of PDF Editor licences,Find a Tender,https://www.find-tender.service.gov.uk/Notice/032369-2026
032368-2026,Manned Guarding,Waythrough,3070000.0,79710000,planningUpdate,2026-04-09T12:43:54+01:00,Provision of Manned Guarding and Security Services,Find a Tender,https://www.find-tender.service.gov.uk/Notice/032368-2026
032367-2026,Transactional Satisfaction Survey Platform,Plus Dane Housing Limited,,,"award, contract",2026-04-09T12:40:34+01:00,"Platform to send, receive and manage transactional satisfaction surveys for customers",Find a Tender,https://www.find-tender.service.gov.uk/Notice/032367-2026
032366-2026,NFCC National Firefighter PPE - Lot 8 (Cleaning and Maintenance),Kent and Medway Towns Fire and Rescue Authority,,,"award, contract",2026-04-09T12:39:59+01:00,"Kent and Medway Towns Fire and Rescue Authority on behalf of NFCC, as the Contracting Authority, is seeking to establish a series of open Framework Agreements. Each successive open framework will be for specific products and/or services that will be awarded to successful suppliers, pursuant to which the Participating Authorities listed in Annex 1 of the Procurement Specific Questionnaire may award a Call-Off Agreement. 
This Tender Notice relates to 'Lot 8 (Cleaning and Maintenance)' 
The Procurement Specific Questionnaire will be published alongside this Tender Notice. The draft ITT (which will include the draft form of Framework Agreement and draft form of Call-Off Agreement) will include details of the call-off procedure. 
'Lot 8 (Cleaning and Maintenance)' relates to the provision of associated cleaning, repair, servicing and maintenance of Fire Structural PPE, Lightweight Firefighting PPE, as set out within the Specification and Requirement document for this Lot. 
This procurement will start with a participation stage comprising of the completion of the Procurement Specific Questionnaire and the information required to be submitted to the Central Digital Platform by potential bidders. Those successful at the participation stage will progress to the tender stage and will be invited to submit a formal tender in response to the Invitation to Tender (ITT).  The evaluation process for the tender stage will include wearer trials and site visits.  
It is intended that up to 3 successful suppliers will each be awarded a Framework Agreement (subject to the Contracting Authority's discretion to increase the number of successful suppliers beyond 3). Participating Authorities will be able to enter into a Call-Off Agreement under the Framework Agreement following the call-off procedure.  
The Contracting Authority reserves the right to charge a levy to the successful suppliers as set out within the draft ITT. 
Where there is more than 1 successful supplier, it is intended that each Framework Agreement will have a maximum term of 8 years. It is anticipated that the successive frameworks will re-open as follows: in (i) March 2029 and (ii) between March 2032 and March 2033. These dates may be subject to change at the discretion of the Contracting Authority.
Access Code to PSQ : FAJDDJ6886",Find a Tender,https://www.find-tender.service.gov.uk/Notice/032366-2026
032365-2026,London Borough of Sutton,"Sutton, Achieving for Children and Kingston",,60000000,"award, contract",2026-04-09T12:38:14+01:00,London Borough of Sutton,Find a Tender,https://www.find-tender.service.gov.uk/Notice/032365-2026
032364-2026,Youth Services at Lift and Rose Bowl sites,London Borough of Islington,4620000.0,85300000,planning,2026-04-09T12:36:59+01:00,"This notice is a PIPELINE NOTICE and therefore is NOT currently a call for competition. For the avoidance of doubt, the Pipeline Notice is intended to provide the most accurate forecast currently available for the council’s high value procurement activity, but does not commit the council to procuring any contract and may be amended after publication.",Find a Tender,https://www.find-tender.service.gov.uk/Notice/032364-2026
032363-2026,Community Link Worker Service,The City of Edinburgh Council,,"85323000, 85000000","award, contract",2026-04-09T12:36:46+01:00,"The Community Link Worker Service offers non-clinical support to a variety of patient cohorts, following referrals made by GP Practice Teams. Edinburgh’s Community Link Worker Service is currently delivered by a network of eight third sector organisations.",Find a Tender,https://www.find-tender.service.gov.uk/Notice/032363-2026
032362-2026,Pacenet for Cardiology,Gloucestershire Hospitals NHS Foundation Trust,,,"award, contract",2026-04-09T12:36:34+01:00,"A three year Pacenet licence, using the existing allocation of Medpoints to fund the purchase. This contract has an extension option of 12 months beyond the initial term. 
Estimated contract value (Three-year licence)
• £0 initial licence outlay.
• £100,000 (ex VAT), equivalent to £33,333 per year if we had not procured through Medpoints.",Find a Tender,https://www.find-tender.service.gov.uk/Notice/032362-2026
032361-2026,Provision of Cleaning Services to Lincolnshire Police,Police and Crime Commissioner for Lincolnshire,,,"award, contract",2026-04-09T12:35:22+01:00,"Provision of Cleaning Services to Lincolnshire Police including Core Cleaning, Reactive and Adhoc Cleans, Window Cleaning, Laundry Cleaning Services, and Vehicle Decontamination Services.",Find a Tender,https://www.find-tender.service.gov.uk/Notice/032361-2026
032360-2026,Supply of 2 Ion Chromatography systems,Nuclear Restoration Services Limited,,,"award, contract",2026-04-09T12:34:28+01:00,A direct award contract has been awarded by Nuclear Restoration Services Limited (Dounreay) for the supply of 2x Ion Chromatography Systems.,Find a Tender,https://www.find-tender.service.gov.uk/Notice/032360-2026
032359-2026,Arden Multi Academy Trust - Grounds Maintenance,ARDEN MULTI ACADEMY TRUST,,,"award, contract",2026-04-09T12:31:46+01:00,"Trust is currently out to tender for the provision of a Grounds Maintenance service.
The contract is being offered for three years with the option to extend for a further two periods of 12 months.  The contract commencement date is 13 April 2026.
The Contractor will be responsible for the provision of a grounds maintenance service for the Trust. This will consist of services for each school across all sites.
There is a combined total of 308,324m2 (entire school site square meterage) and 34,300m2 Building Footprint across all sites with approximately 6,000 pupils on roll.
TUPE/LGPS does not apply to this tender.
The Contractor will be responsible for the provision of skilled ground maintenance operatives providing an efficient and timely maintenance service.",Find a Tender,https://www.find-tender.service.gov.uk/Notice/032359-2026
032358-2026,Patient Administration System (CAMIS),Northampton General Hospital NHS Trust,,72212180,"award, contract",2026-04-09T12:31:41+01:00,Patient Administration System,Find a Tender,https://www.find-tender.service.gov.uk/Notice/032358-2026
032357-2026,GMCA 1755 Bury Training Centre Fire Tile Project,Greater Manchester Combined Authority,,,"award, contract",2026-04-09T12:31:39+01:00,Replacement and repairs of Fire Tile and protective systems at 5 no burn buildings used for live firefighter training at the Bury Training & Safety Centre.,Find a Tender,https://www.find-tender.service.gov.uk/Notice/032357-2026
032356-2026,Schools Digital Devops Department for Education,Department for Education,,72000000,"award, contract",2026-04-09T12:31:18+01:00,The contract was to provide digital software engineers and development engineers for the department for education,Find a Tender,https://www.find-tender.service.gov.uk/Notice/032356-2026
032355-2026,Expert Help for Business,Aberdeenshire Council,,79400000,"award, contract",2026-04-09T12:29:58+01:00,The council is looking to procure consultancy support for a variety of different topics for business support within Aberdeen City & Aberdeenshire.,Find a Tender,https://www.find-tender.service.gov.uk/Notice/032355-2026
032354-2026,National Pipette Replacement,Scottish Police Authority,,"38437000, 38437100","award, contract",2026-04-09T12:29:27+01:00,National Pipette Replacement,Find a Tender,https://www.find-tender.service.gov.uk/Notice/032354-2026
032353-2026,Expert Help for Business,Aberdeenshire Council,,79400000,"award, contract",2026-04-09T12:29:10+01:00,The council is looking to procure consultancy support for a variety of different topics for business support within Aberdeen City & Aberdeenshire.,Find a Tender,https://www.find-tender.service.gov.uk/Notice/032353-2026
032352-2026,Glasgow City Mental Health Service (MHS) and Glasgow Alcohol and Drug Recovery (GADRS) Employability Service,NHS Greater Glasgow and Clyde,1300000,85000000,tender,2026-04-09T12:28:49+01:00,"Glasgow City Health and Social Care Partnership are seeking a dynamic organisation(s), or partnership of organisations, to deliver Employability Services across the city.
It is expected that flexible, culturally appropriate approaches will be used and that suppliers will demonstrate a sophisticated understanding of inequalities in Glasgow City. This should include barriers for people who experience multiple vulnerabilities, particularly people with mental health conditions and people with a history of problematic alcohol and drug misuse.
The successful supplier(s) will work collaboratively with existing partnerships and, where appropriate, form new partnerships with a range of voluntary and statutory organisations.
The aim of the service is to:
-Promote and support recovery and increase access to employability opportunities for people aged 16 and over who have long term mental health conditions and people aged 18 and over who are in recovery from problematic alcohol and/or drug misuse.
-To increase the number of individuals to move into employment and increase access to employment opportunities.
-To provide access to local community services through collaborative working with a range of voluntary and statutory organisations.",Find a Tender,https://www.find-tender.service.gov.uk/Notice/032352-2026
032351-2026,Islington Carers Hub,London Borough of Islington,1512190.0,85000000,planning,2026-04-09T12:28:32+01:00,"This notice is a PIPELINE NOTICE and therefore is NOT currently a call for competition. For the avoidance of doubt, the Pipeline Notice is intended to provide the most accurate forecast currently available for the council’s high value procurement activity, but does not commit the council to procuring any contract and may be amended after publication.",Find a Tender,https://www.find-tender.service.gov.uk/Notice/032351-2026
032350-2026,Subcontractor Services Framework Agreement,Scottish Borders Council,,"50000000, 45262500, 45112700, 43400000, 45262410, 45262420, 44114200, 44212310, 77211400, 77342000, 77340000, 77211500, 45342000, 45340000, 44313100, 44231000, 34928310, 45233220, 45233253, 45233251, 45233200, 45233228, 45262300, 45262310, 45221100, 45262210, 45261420, 45233222, 45233120, 34922100, 44512600, 45233142, 90640000, 90610000, 50230000, 77314000, 50232200, 63712200, 45233292, 34928470, 71620000, 71351500, 71600000, 71631400, 45120000, 71630000, 71631480, 39370000, 98110000, 98112000","award, contract",2026-04-09T12:27:35+01:00,"Scottish Borders Council (the Council) wishes to establish a 2nd generation framework agreement for the provision of Subcontracting Services for use by Council services, including the Council’s significant trading organisation SBc Contracts and other named collaborative partners.",Find a Tender,https://www.find-tender.service.gov.uk/Notice/032350-2026
032349-2026,"Intelligent Transport Systems including traffic signals, variable message signs and car park signs",Southend-on-Sea City Council,3000000,"34924000, 34970000, 34992000, 34996000, 45233290, 45233294, 45316200, 45316210, 45316211, 45316212, 45316213, 50232200",tender,2026-04-09T12:27:14+01:00,"Southend-on-Sea City Council is looking to appoint a suitable Supplier to supply, install and maintain intelligent transport systems and associated equipment including traffic signals, Variable Message Signs, RGB Signs, School Warning Signs, Car Park Guidance Signs, Car Park Count controllers and Vehicle Speed Activated Signs.
All equipment is within the City of Southend and the Council will provide the Supplier with access to an asset management system where all faults and issues will be logged. The Supplier will be required to interrogate the Council's system on a daily basis to pick up faults, attend to rectify faults and then update the Council's system to confirm that the fault has been rectified. The Supplier will also be required to undertake annual inspections and internal cleaning of equipment.
The Supplier will also be required to supply and install new equipment. This will vary throughout the life of the contract due to the level of funding available and/or external grant money becoming available.
The required services are set out in full in the Scope (one of the associated tender documents).
The mechanisms for ordering work under the Contract are set out in the associated tender documents together with details of the volume and value of work that may be ordered.",Find a Tender,https://www.find-tender.service.gov.uk/Notice/032349-2026
032348-2026,Asbestos Removal and Reinstatement,London Borough of Islington,1760000.0,45000000,planning,2026-04-09T12:26:28+01:00,"This notice is a PIPELINE NOTICE and therefore is NOT currently a call for competition. For the avoidance of doubt, the Pipeline Notice is intended to provide the most accurate forecast currently available for the council’s high value procurement activity, but does not commit the council to procuring any contract and may be amended after publication.",Find a Tender,https://www.find-tender.service.gov.uk/Notice/032348-2026
032347-2026,Wycombe Women's Centre Refurbishment,BUCKINGHAMSHIRE HEALTHCARE NHS TRUST,,45210000,"award, contract",2026-04-09T12:25:20+01:00,Reconfiguration and refurbishment of existing clinical accommodation,Find a Tender,https://www.find-tender.service.gov.uk/Notice/032347-2026
032346-2026,Planning Related Advice Professional Services Framework,NATURAL ENGLAND,8000000.0,71410000,planning,2026-04-09T12:24:06+01:00,"Natural England is the government’s statutory adviser for the natural environment in England, a statutory consultee across the terrestrial and marine planning systems, and the regulator for protected species licensing. Its purpose is to ensure that the natural environment is conserved, enhanced and managed for the benefit of present and future generations, contributing to sustainable development. The organisation plays a central role in advising on development and infrastructure planning, delivering species licensing, shaping environmental outcomes in plans and projects, and supporting the delivery of national ambitions such as the 25 Year Environment Plan.
The Authority intends to establish a new Open Framework to replace the current Natural England Planning Related Advice Professional Services (NE PRAPS) Framework (established under PCR 2015), which expires in 2027. The new framework will operate for up to an eight (8) year period, with multiple suppliers appointed across a range of technical Lots.
The framework will provide access to suppliers with the capability to deliver specialist planning related advice and training across Natural England’s Sustainable Development (SD) Programme.
Suppliers appointed to the framework will support Natural England in meeting its statutory obligations as a consultee in land use and marine planning, infrastructure planning systems, and environmental assessments. 
Framework suppliers will provide expert advice on strategic plans, medium  and high risk or high opportunity planning casework, and associated environmental assessments including Habitats Regulations Assessment (HRA), Strategic Environmental Assessment / Sustainability Appraisal (SEA/SA), and Environmental Impact Assessment (EIA). They will also support Natural England’s national planning work, including input on planning and infrastructure legislation, policy and processes, and on wider environmental reforms affecting planning and assessment regimes.
The scope of services will additionally encompass advice across a wide range of environmental and technical specialisms relevant to development and infrastructure (terrestrial and marine), the provision of evidence based assessments and analysis, and the delivery of targeted planning related training to Natural England staff, local planning authorities and other decision makers. 
This framework will support Natural England’s proactive, strategic engagement in planning and licensing, helps address short term skills and capacity gaps, and contributes to achieving better outcomes for people, places, habitats and species across England’s land and seascapes.",Find a Tender,https://www.find-tender.service.gov.uk/Notice/032346-2026
