id,title,buyer,value,cpvs,stage,published_date,description,source,source_url
032200-2026,Adult ADHD Services,NHS Essex Integrated Care Board,,"85100000, 85121270","award, contract",2026-04-09T10:02:48+01:00,"The ICB Commissioners in NHS Essex Integrated Care Board (formerly NHS Mid and South Essex ICB) wish to provide their patients with a choice of providers who can deliver high quality Adult ADHD services and care in accordance with the terms of this agreement and in particular all relevant Guidance.
The service provided under this notice will be for Adult ADHD Services under patient choice provision.
The contract award has been made following Direct Award Process B under the Health Care Services (Provider Selection Regime) Regulations 2023 and the Public Contract Regulations 2015 (as amended) do not apply.
These contracts have been awarded with no guarantee of activity. The actual contract value will vary dependent on the activity delivered. Therefore, this notice outlines a total contract value of £0.00. )",Find a Tender,https://www.find-tender.service.gov.uk/Notice/032200-2026
032199-2026,Norfolk and Norwich University Hospitals NHS Foundation Trust (NNUH) 2022 - 2027 (2526-191 - CV132),NHS NORFOLK AND SUFFOLK INTEGRATED CARE BOARD,,85110000,"awardUpdate, contractUpdate",2026-04-09T10:01:47+01:00,"This is a Provider Selection Regime (PSR) contract modification notice, under the Health Care Services (Provider Selection Regime) Regulations 2023. For the avoidance of doubt, the provisions of the Procurement Act Regulations 2024 do not apply to this award. This contract has been formally modified.
Conflicts of Interest - No conflict of interests were declared prior, or during the preparation and award of the contracts.
Memorandum of Understanding from NHSE dated 1 October 2025.
Modification approved by ICB Executive Director of Finance and Contracts.",Find a Tender,https://www.find-tender.service.gov.uk/Notice/032199-2026
032198-2026,"Kitchen, Bathroom & WC Replacement Project",Barcud Shared Services,11166666.67,"45200000, 45000000",tenderUpdate,2026-04-09T10:01:32+01:00,"Measured Term Contract for kitchen replacements (supply and installation) and associated works to Bron Afon properties. Additional works included within the project is flooring, decoration, smoke alarm system upgrade, bathroom and WC replacements as required.",Find a Tender,https://www.find-tender.service.gov.uk/Notice/032198-2026
032197-2026,DWP Courier Services,Department for Work & Pensions,30000000.0,64120000,planning,2026-04-09T10:00:39+01:00,"The DWP Courier Service contract covers the secure transportation of DWP Internal mail items within the DWP courier network, which are fully tracked and traced.",Find a Tender,https://www.find-tender.service.gov.uk/Notice/032197-2026
032196-2026,Parkwood Springs,Sheffield City Council,30000,"79415200, 22314000, 34992000, 44423400, 79822500",tender,2026-04-09T10:00:31+01:00,"requirements for the design, manufacture and installation of site signage within the ‘Active Country Park’",Find a Tender,https://www.find-tender.service.gov.uk/Notice/032196-2026
032195-2026,Nightly Paid Temporary Accommodation,London Borough of Islington,52000000.0,98341000,planning,2026-04-09T09:59:39+01:00,"This notice is a PIPELINE NOTICE and therefore is NOT currently a call for competition. For the avoidance of doubt, the Pipeline Notice is intended to provide the most accurate forecast currently available for the council’s high value procurement activity, but does not commit the council to procuring any contract and may be amended after publication.",Find a Tender,https://www.find-tender.service.gov.uk/Notice/032195-2026
032194-2026,2526-0140 Short-breaks for children and young people,London Borough of Islington,8805000.0,85000000,planning,2026-04-09T09:56:54+01:00,"This notice is a PIPELINE NOTICE and therefore is NOT currently a call for competition. For the avoidance of doubt, the Pipeline Notice is intended to provide the most accurate forecast currently available for the council’s high value procurement activity, but does not commit the council to procuring any contract and may be amended after publication.",Find a Tender,https://www.find-tender.service.gov.uk/Notice/032194-2026
032193-2026,2526-0294 Local Electric Vehicle Infrastructure (LEVI) Procurement for 5kw lamp column Electric Vehicle Infrastructure,London Borough of Islington,1285770.0,51000000,planning,2026-04-09T09:53:15+01:00,"This notice is a PIPELINE NOTICE and therefore is NOT currently a call for competition. For the avoidance of doubt, the Pipeline Notice is intended to provide the most accurate forecast currently available for the council’s high value procurement activity, but does not commit the council to procuring any contract and may be amended after publication.",Find a Tender,https://www.find-tender.service.gov.uk/Notice/032193-2026
032192-2026,Contact Centre Omnichannel Solution,London Borough of Islington,1977019.0,72222300,planning,2026-04-09T09:49:37+01:00,"This notice is a PIPELINE NOTICE and therefore is NOT currently a call for competition. For the avoidance of doubt, the Pipeline Notice is intended to provide the most accurate forecast currently available for the council’s high value procurement activity, but does not commit the council to procuring any contract and may be amended after publication.",Find a Tender,https://www.find-tender.service.gov.uk/Notice/032192-2026
032191-2026,The Provision of Surfacing Works,Bolsover District Council,,,"award, contract",2026-04-09T09:48:54+01:00,To appoint a suitability qualified contractor to surfacing works across Bolsover District Council's network,Find a Tender,https://www.find-tender.service.gov.uk/Notice/032191-2026
032190-2026,Company Health Insurance,Commercial Services,,66512200,"award, contract",2026-04-09T09:48:20+01:00,Health insurance services,Find a Tender,https://www.find-tender.service.gov.uk/Notice/032190-2026
032189-2026,Occupational Health Doctor Service,Darlington Borough Council,,,"award, contract",2026-04-09T09:47:02+01:00,Prevision of Occupational Health Doctor Service,Find a Tender,https://www.find-tender.service.gov.uk/Notice/032189-2026
032188-2026,"2122-0063 Digital Experience Platform, DEP",London Borough of Islington,1919890.0,72222300,planning,2026-04-09T09:46:59+01:00,"This notice is a PIPELINE NOTICE and therefore is NOT currently a call for competition. For the avoidance of doubt, the Pipeline Notice is intended to provide the most accurate forecast currently available for the council’s high value procurement activity, but does not commit the council to procuring any contract and may be amended after publication.",Find a Tender,https://www.find-tender.service.gov.uk/Notice/032188-2026
032187-2026,Building Compliance Document Checking Service,PLATFORM HOUSING LIMITED,,,"award, contract",2026-04-09T09:45:50+01:00,"Platform Housing Limited has awarded a contract for the provision of a cloud-based Building Compliance Document Checking Service to support statutory compliance and asset management activities.
The service provides automated validation and verification of compliance certificates submitted by contractors, structured data capture, compliance risk scoring, centralised compliance record management, and reporting functionality to support regulatory assurance and internal governance.
The contract has been awarded to the incumbent provider to ensure continuity of a system that is embedded within operational processes and supports compliance monitoring across multiple statutory areas.
This contract has been awarded via a direct award under the Crown Commercial Service G-Cloud 14 Framework (RM1557.14), which was established under the Public Contracts Regulations 2015.
Due to system limitations preventing linkage to legacy framework notices under a different regulatory regime, this notice has been recorded as a below-threshold procedure.",Find a Tender,https://www.find-tender.service.gov.uk/Notice/032187-2026
032186-2026,MVH26007 - EWI Installation ,Barcud Shared Services,4080000.0,"45000000, 71000000",tenderUpdate,2026-04-09T09:44:29+01:00,"The project comprises the installation of External Wall Insulation (EWI) up to 143 properties subject to final budget approval. These works form part of the Optimised Retrofit Programme (ORP) and must be delivered exclusively by TrustMark-accredited suppliers, in line with programme requirements. 
The scope of work may include: 
External Wall Insulation (EWI) systems installation 
Roofline alterations (including adjustments to soffits, fascia’s, gutters as required to accommodate insulation thickness and meet compliance standards) 
Ventilation system upgrades or installations to ensure adequate airflow and prevent moisture issues 
AICO sensor installation to support property safety, monitoring and compliance 
Groundworks, where required, to ensure proper detailing at the base of the insulation system and to accommodate any remedial works 
All activities must be fully compliant with PAS 2035 standards, 
Expected duration: 40 weeks",Find a Tender,https://www.find-tender.service.gov.uk/Notice/032186-2026
032185-2026,L25055-Q-OJ - Liquefied Propylene Gas (LPG) Supplier,London Luton Airport Operations Limited,,"09133000, 09120000",tender,2026-04-09T09:43:11+01:00,"Introduction:
The Tendered Opportunity is for qualified suppliers who are invited to participate in a tender for the supply and delivery of bulk LPG for London Luton Airport’s Fire Station and Operations Centre. The LPG will be used for Fire Training purposes that support critical firefighting operations.
Purpose and Context:
LLA seeks to award a new contract for the provision to supply LPG for our three storage vessels that presently are used for our Fire Training Simulator to train aviation Firefighters in the art of tackling aircraft fires. In addition, the LPG is also used for LLA’s incinerator.
Contract term and mechanics:
This contract will be awarded on a call-off agreement basis for a period of five years (4+1) and shall be on a non-exclusive basis, utilizing LLA’s contract template, included as part of this RFB. - help me fill out all the sections for a notice with this information",Find a Tender,https://www.find-tender.service.gov.uk/Notice/032185-2026
032184-2026,C-014171 - Inclusive Sports Programme Re-Tender,Newcastle City Council,,"85000000, 98000000",tender,2026-04-09T09:42:52+01:00,Newcastle City Council is seeking to appoint a provider to plan and deliver a range of inclusive sports activities across Newcastle upon Tyne for children and young people with additional needs and their friends.,Find a Tender,https://www.find-tender.service.gov.uk/Notice/032184-2026
032183-2026,Third Line Support for Network Rail (High Speed),NETWORK RAIL (HIGH SPEED) LIMITED,,,"award, contract",2026-04-09T09:42:41+01:00,"Network Rail (High Speed) intends to award a contract for a Third Line Support to Compagnie des Signaux.  This is an ongoing contract which provides signalling and control systems on the HS1 route, including RCCS and associated proprietary platforms. Services include incident support, fault investigation and recovery, maintenance of development and support environments, diagnostics and repair of critical equipment, obsolescence monitoring, contract and service management, and system specific training. 
The services can only be delivered by the supplier as the sole owner of the system-level intellectual property.",Find a Tender,https://www.find-tender.service.gov.uk/Notice/032183-2026
032182-2026,2526-0254 Jessop Court - Communal Heating Renewal,London Borough of Islington,1530000.0,45000000,planning,2026-04-09T09:42:18+01:00,"This notice is a PIPELINE NOTICE and therefore is NOT currently a call for competition. For the avoidance of doubt, the Pipeline Notice is intended to provide the most accurate forecast currently available for the council’s high value procurement activity, but does not commit the council to procuring any contract and may be amended after publication.",Find a Tender,https://www.find-tender.service.gov.uk/Notice/032182-2026
032181-2026,PR112026 Edwards Court Catering Outsourced Staffing,Exeter City Council,100000.0,"55500000, 79600000",planning,2026-04-09T09:40:41+01:00,"Edwards Court requires a compliant and resilient staffing-only catering solution to ensure the continued provision of safe meals during weekends, bank holidays, and periods of staff absence. The contract will provide qualified catering staff, including chef, assistant chef, and kitchen assistant roles, with all personnel holding Level 2 Food Safety certification, enhanced DBS checks, and appropriate safeguarding training, while Exeter City Council (ECC) retains full control over food procurement, menu planning, and day-to-day kitchen operations.
Chef-level staff must be competent in delivering meals in line with IDDSI standards for modified diets within a care environment. The procurement will be delivered in two stages, commencing with a UK2 Preliminary Market Engagement exercise to inform the final specification, followed by a Request for Quotation (RFQ) issued using objective and proportionate criteria. Participation in market engagement will not be a condition of participation in the RFQ.",Find a Tender,https://www.find-tender.service.gov.uk/Notice/032181-2026
032180-2026,C-013568 Inclusive Youth Project,Newcastle City Council,,,tenderCancellation,2026-04-09T09:39:30+01:00,No description provided,Find a Tender,https://www.find-tender.service.gov.uk/Notice/032180-2026
032179-2026,2425-0663 Housing Management Solution,London Borough of Islington,2900000.0,72222300,planning,2026-04-09T09:39:15+01:00,"This notice is a PIPELINE NOTICE and therefore is NOT currently a call for competition. For the avoidance of doubt, the Pipeline Notice is intended to provide the most accurate forecast currently available for the council’s high value procurement activity, but does not commit the council to procuring any contract and may be amended after publication.",Find a Tender,https://www.find-tender.service.gov.uk/Notice/032179-2026
032178-2026,C013569 Inclusive Sports Programme,Newcastle City Council,,,tenderCancellation,2026-04-09T09:38:54+01:00,No description provided,Find a Tender,https://www.find-tender.service.gov.uk/Notice/032178-2026
032177-2026,SEND Mediation and Disagreement Resolution Services,Lancashire County Council,,85000000,planning,2026-04-09T09:38:37+01:00,"Lancashire County Council (the Council) is engaging with the market for the provision of a statutory mediation and disagreement resolution service for children and young people, aged 0-25, with Special Education Needs and Disabilities (SEND).
• Mediation & Disagreement Resolution
• Information, advice & signposting
• Tribunal-related mediation sessions",Find a Tender,https://www.find-tender.service.gov.uk/Notice/032177-2026
032176-2026,"Participatory & Deliberative Engagement: A Stronger, Fairer Community in Maidstone Town Centre",Maidstone Borough Council,,"73200000, 79000000",tenderUpdate,2026-04-09T09:37:07+01:00,"Maidstone Borough Council (“the Council”) invites tenders from suitably qualified and experienced organisations to design and deliver a participatory and deliberative engagement programme focused exclusively on Maidstone Town Centre.
The Council is seeking an independent partner to work with residents to explore the lived experience of urban living, with a particular emphasis on fairness, equity, and inclusivity, and on identifying opportunities to build stronger, more resilient communities within the borough’s most diverse and mobile ward. There are a range of connected projects in the Town Centre aimed at strengthening community resilience, improving quality of life, and enhancing universal access. This commission will generate meaningful, evidence-based insight to inform these initiatives, drawing on data, examining socio-economic disparities, and supporting consideration of trade-offs.",Find a Tender,https://www.find-tender.service.gov.uk/Notice/032176-2026
032175-2026,Stop Smoking Service - PSR Direct Award C,Bracknell Forest Borough Council,,85100000,tenderUpdate,2026-04-09T09:33:45+01:00,"Following a Direct Award C process under the Health Care Services (Provider Selection Regime) Regulations 2023 (PSR), Bracknell Forest Council are intending to award the Stop Smoking Service contract to the incumbent Provider as detailed in this notice.
The new contract is for an initial term of One (1) year (1 May 2026 - 30 April 2027) with the option to extend by any number of periods up to an aggregate of 48 months (up to 30 April 2031).
The contract value, for the maximum contract term of 5 years, is anticipated to be £600,000.
The contract will have the ability to be varied by up to an additional £150,000 over the term of the contract, subject to targeted grant funding. If the targeted grant is received, this may be allocated at the Councils discretion. This additional funding would take the total contract value, over the maximum 5-year term of the contract, to £750,000.",Find a Tender,https://www.find-tender.service.gov.uk/Notice/032175-2026
032174-2026,CM3419 Customer Insights,YORKSHIRE WATER SERVICES LIMITED,3000000,"79310000, 79320000, 79330000",tender,2026-04-09T09:33:29+01:00,"Yorkshire Water Services Ltd is seeking to establish a Customer Insights Framework to support the delivery of its strategic objectives for Asset Management Period 8 (AMP8). This framework will enable Yorkshire Water to access high-quality, flexible, and innovative customer research and insight services to inform decision-making, regulatory compliance, and customer-centric service design.
The framework will appoint a panel of experienced suppliers capable of delivering a broad range of qualitative and quantitative research methodologies. These may include, but are not limited to, customer satisfaction tracking, willingness-to-pay studies, behavioral insights, segmentation, vulnerability research, digital engagement analysis, and co-creation activities.
The appointed suppliers will play a critical role in supporting Yorkshire Water's obligations to Ofwat, including the development of robust and defensible customer evidence for business planning and performance commitments under AMP8. Suppliers will be expected to demonstrate strong expertise in regulatory research, water sector experience (or analogous regulated industries), and the ability to deliver insight that drives tangible business outcomes.
The framework is intended to be multi-supplier, ensuring a diverse mix of capabilities and approaches. Yorkshire Water is particularly interested in partners who can offer innovative techniques, advanced analytics, and inclusive engagement strategies to ensure representation of all customer groups, including hard-to-reach and vulnerable populations.
Through this procurement, Yorkshire Water aims to build long-term, collaborative partnerships with insight providers who can support its ambition to deliver exceptional service, enhance customer trust, and meet regulatory expectations effectively and efficiently.",Find a Tender,https://www.find-tender.service.gov.uk/Notice/032174-2026
032173-2026,Radstock Trinty Hub - Project EVE,Radstock Town Council,,45000000,tender,2026-04-09T09:33:06+01:00,"The key elements for Project EVE include installation of new kitchen, new WCs to meet compliance requirements, Secondary glazing, a new heating system and full re-wire,
redecoration and some other minor alteration and refurbishment works.
The site has complex access constraints and working restrictions, these will be detailed within the tender documentation. However, access for this project and works to parts of the building will require micromanagement throughout the delivery phase.",Find a Tender,https://www.find-tender.service.gov.uk/Notice/032173-2026
032172-2026,Procurement Services Partner,Ashfield District Council,,,"award, contract",2026-04-09T09:31:11+01:00,Provision of a procurement service by Nottinghamshire County Council,Find a Tender,https://www.find-tender.service.gov.uk/Notice/032172-2026
032171-2026,Purchase of 3 DJI Drones,ORDNANCE SURVEY LIMITED,,,"award, contract",2026-04-09T09:30:33+01:00,Supply Ordnance Survey with DJI Mavic 3 Multispectral  Platforms including RTK modules (M3M RTK) and four (4) official DJI platform specific batteries per platform. Each platform charging cable is to be supplied with a UK plug as a minimum,Find a Tender,https://www.find-tender.service.gov.uk/Notice/032171-2026
032170-2026,COV - Stoke Park School - Main Works,Coventry City Council,,,"award, contract",2026-04-09T09:29:02+01:00,"COV - Stoke Park Secondary School - Main Works 
Works to construct 8 classroom block and refurbishment of existing youth centre building to convert to drama studio, including associated external play area and landscaping.",Find a Tender,https://www.find-tender.service.gov.uk/Notice/032170-2026
032169-2026,"Support to deliver a focused, operational review-Long-Term Care & Support Service in Medway Council",Improvement and Development Agency for Local Government (IDeA),,85300000,tender,2026-04-09T09:28:59+01:00,"PCH wish to procure an operational review of the Long-term care and Support Service on behalf of Medway council to enable
•	A clear understanding of why the large backlog of reviews persists (further described below)
•	Evidence-based options to restore compliance and performance and variability of experience
•	A realistic plan to reduce the backlog at pace
•	Improved workforce deployment and operational grip
•	Reduced statutory and regulatory risk
This work aims to provide an understanding of the issues causing the backlog, a number of options for improving the situation and reduce the risk of Statutory non-compliance and poor experiences of residents of Medway.
We require an experienced contractor that can work alongside Medway’s Leadership and PCH to develop and deliver a focused, time-limited operational review of the Long-Term Care & Support Service
Outputs.
There will be a mid-point report, which will alert Medway to any early findings.
In addition, there will be a final report (in a format to be agreed with Medway and PCH) that will cover:
•	An evidence based and detailed assessment of the root causes of backlogs
•	An assessment of workforce deployment and whether it could be improved
•	An assessment of whether management oversight is sufficient and how it can be improved
•	A rigorous testing of current plans to address the backlogs and their likelihood to succeed (including the impact and risk of transferring staff to the Targeted Review Team)
•	An assessment of statutory and regulatory risk (including DOLS)
•	A set of recommendations that bring together findings and maps out a proposed plan.
You will need to demonstrate with evidence that you meet the below mandatory criteria.
•	Senior level experience of adult social care
•	Previous relevant experience and understanding of statutory guidance and regulations in adult social care that are relevant to this task
•	Previous relevant experience of data analysis, process flow and causal analysis within a similar environment and task
In less than 600 words please describe, with examples, how you would:
•	Devise the methodology for this task
•	Present the outline methodology including what you believe to be the key issues and risks
•	Describe how you would present a final report that was of immediate use to Medway (what aspects would be essential and how might you do this?)
Your tender documents along with other completed documents as requested in the ITT will need to be submitted on the Panacea procurement portal before the closure date.",Find a Tender,https://www.find-tender.service.gov.uk/Notice/032169-2026
032168-2026,Provision of Technology Service of the future roadmap products within payments,BANK OF ENGLAND,25000000,72000000,planning,2026-04-09T09:26:33+01:00,"Provision of Technology Service of the future roadmap products within payments
This is currently in the early planning stages and still being discussed internally",Find a Tender,https://www.find-tender.service.gov.uk/Notice/032168-2026
032167-2026,UKRI-5992 Detection and Response Service,UK Research & Innovation (UKRI),,,"award, contract",2026-04-09T09:26:19+01:00,UK Research and Innovation has a requirement for the continuation of a critical cyber defence service.,Find a Tender,https://www.find-tender.service.gov.uk/Notice/032167-2026
032166-2026,"Invitation to Tender for Replacement Flat Roofing at Hereford College Road Campus, College Road, Hereford HR1 1EB",Herefordshire Council,,,"award, contract",2026-04-09T09:25:53+01:00,"Herefordshire Council has identified Capital funding to carry out works to improve some of its educational facilities and is seeking to appoint a Principal Contractor to carry out improvement works for Flat Roofing at Hereford College of Arts, College Road Campus, Hereford.",Find a Tender,https://www.find-tender.service.gov.uk/Notice/032166-2026
032165-2026,The Maintenance of Traffic Control and Associated Equipment,Rhondda Cynon Taf CBC,,,"award, contract",2026-04-09T09:24:21+01:00,Contract Award for The Maintenance of Traffic Control and Associated Equipment,Find a Tender,https://www.find-tender.service.gov.uk/Notice/032165-2026
032164-2026,UKRI-5992 Detection and Response Service,UK Research & Innovation (UKRI),,,"award, contract",2026-04-09T09:23:23+01:00,UK Research and Innovation has a requirement for the continuation of a critical cyber defence service.,Find a Tender,https://www.find-tender.service.gov.uk/Notice/032164-2026
