id,title,buyer,value,cpvs,stage,published_date,description,source,source_url
032621-2026,Provision of gardening and grounds maintenance services for the British High commission in Georgetown residence,"Foreign, Commonwealth and Development Office",,,"award, contract",2026-04-09T20:50:46+01:00,"The requirement encompasses the full delivery of gardening and grounds maintenance services essential to the Mission’s operations. This includes ongoing lawn care, pruning of trees and shrubs, and the upkeep of landscaped areas to ensure the premises remain presentable, safe, and aligned with expected professional standards. The service also involves the regular removal of green waste and debris, the maintenance and cleaning of external communal areas, and seasonal tasks such as treatment and basic pest control where needed.",Find a Tender,https://www.find-tender.service.gov.uk/Notice/032621-2026
032620-2026,ServiceNow Specialist Managed Services,Government Property Agency,,,"award, contract",2026-04-09T20:01:30+01:00,"The ServiceNow Specialist Managed Service provides end-to-end support, development, and optimisation of the ServiceNow platform to ensure stable, secure, and efficient operation of GPA's digital services.",Find a Tender,https://www.find-tender.service.gov.uk/Notice/032620-2026
032619-2026,Market Engagement for the Provision of Post 16 Supported Accommodation and Support Services-Framework (2),Bradford Children & Families Trust,9250000,"85311000, 85310000",planning,2026-04-09T19:30:23+01:00,"Purpose of the event: The session will provide an opportunity to: • Outline BCFT’s commissioning intentions for Lots 2 to 6 • Clarify the scope, service models, and expectations across these Lots • Discuss key quality, compliance, and outcome requirements, including alignment with the Supported Accommodation (England) Regulations 2023 • Enable providers to ask questions and seek clarification in advance of the formal tender publication. The event forms part of BCFT’s wider engagement with the market to ensure the Framework supports a diverse, high-quality provider base and delivers improved outcomes for young people aged 16 to 25, including looked-after children, care leavers, and unaccompanied asylum-seeking children (UASC). Framework Lots – Scope The Market Engagement Event will focus on Lots 2 to 6 only. Providers with an interest in delivering services within these Lots are strongly encouraged to attend. Further details on individual Lot requirements will be provided during the session. Event Details • Event: Additional Market Engagement Event • Focus: Lots 2–6 – Post 16 Supported Accommodation and Support Services Framework • Location: Microsoft Teams • Date and Time: Wednesday 22nd April - 11:00 until 11:45 Registration To register your interest in attending this Market Engagement Event, please email: ChildrensCommissioning@bradford.gov.uk . Please use the subject line: Market Engagement Event – Post 16 Supported Accommodation Framework (Lots 2–6). Joining instructions and further details will be shared with registered attendees ahead of the event. Procurement Portal. The formal procurement opportunity will be published via eu supply.com. Providers are advised to ensure they are registered on the portal to access documentation and submit any future bids.",Find a Tender,https://www.find-tender.service.gov.uk/Notice/032619-2026
032618-2026,Professional Services - Interim Senior Building Safety Manager,Bristol City Council,,79000000,"award, contract",2026-04-09T18:55:40+01:00,Interim Senior Building Safety Manager,Find a Tender,https://www.find-tender.service.gov.uk/Notice/032618-2026
032617-2026,LSL/GS/0132 - The Supply of Common Captured Persons Handling Kit,"LEIDOS SUPPLY, LIMITED",,,"award, contract",2026-04-09T18:22:06+01:00,"Team Leidos are proud to be delivering the logistics commodities and services transformation (LCS(T)) Delivery partner contracts (LCS (T)/0001 dated 16.4.2015) on behalf of the UK Ministry of Defence (the ‘Prime Contract’). Delivery of other parts of the LCS(T) contract are delivered by Leidos Europe Ltd (LEL) and other partners (together ‘Team Leidos’). This requirement is subject to the Public Procurement Regulations and respective advertising action.
In April 2015, the MOD signed a thirteen year contract with Leidos Europe Ltd to provide the procurement and inventory management of commodity items (as well as the storage and distribution services), that were historically provided in-house by the Logistic Commodities and Services Operating Centre. 
Leidos, working with the MOD, will transform the way these services are delivered to ensure requirements continue to be met whilst providing best value for money for the department. The organisation delivering these services is known as Team Leidos.
Team Leidos would like to make interested suppliers aware that it has awarded tenders for its supply and delivery of Captured Persons Handling Kit.
Further to the tender notice issued on 06/10/2025, reference LSL/GS/0132 - The Supply of Captured Persons Handling Kit, notice number 2025/S 000-062475, Leidos Supply Ltd will award the Supply of Captured Persons Handling Kit to BCB International Ltd on a 4 year term from 18/05/2026, with an estimated value of £600,000 across the 4 years.",Find a Tender,https://www.find-tender.service.gov.uk/Notice/032617-2026
032616-2026,ENERGY AND UTILITIES SERVICES DYNAMIC MARKET,FIDELITY ENERGY LIMITED,,,"award, contract",2026-04-09T18:20:49+01:00,No description provided,Find a Tender,https://www.find-tender.service.gov.uk/Notice/032616-2026
032615-2026,QRoutes subscription,Sefton Metropolitan Borough Council,,48000000,"award, contract",2026-04-09T17:49:03+01:00,"QRoutes - A cloud based tool for planning transport for SEND, mainstream schools and social care",Find a Tender,https://www.find-tender.service.gov.uk/Notice/032615-2026
032614-2026,Preconstruction Design Services for Sprinkler and MEP Works for Thames Road Building,BE FIRST (REGENERATION) LTD.,866600,"71300000, 71500000",tender,2026-04-09T17:44:53+01:00,"On behalf of the London Borough of Barking and Dagenham, Be First Regeneration Ltd is pleased to invite you to tender for the specified requirement pursuant to expression of interest for a two-stage design and build procurement, with Stage 1 appointment under a PCSA.",Find a Tender,https://www.find-tender.service.gov.uk/Notice/032614-2026
032613-2026,Preliminary Market Engagement - Non-Convicted Perpetrator Programme,North East Lincolnshire Borough Council,330000,"85312300, 85000000, 85312500, 98000000",planning,2026-04-09T17:30:25+01:00,"North East Lincolnshire Council (the Authority) is seeking to engage with the market to inform the future commissioning of a Non-Convicted Perpetrator Programme (NCPP), and to gather insight and feedback from the market to support this process.",Find a Tender,https://www.find-tender.service.gov.uk/Notice/032613-2026
032612-2026,003317 - Window Cleaning Service,Durham County Council,,,"award, contract",2026-04-09T17:28:12+01:00,"Window cleaning provision is required as part of the cleaning service agreements we deliver to services across DCC both internally and externally. Two planned window cleans for each building we provide cleaning to is part of the service agreement. Over 120 buildings will require window cleaning including libraries, Family hubs & children centres, theatres, town halls, strategic buildings and many others. The provider must be able to demonstrate correct health and safety protocols, evidence risk assessments and method statements and provide any staff training to be able to carry out safe & effective work. The provider will have access to a variety of moveable platforms to complete working at height. The provider will be able to manage a complex workload, plan periodic window cleaning and issue correct invoices & satisfaction notes. 
Please note this is an interim arrangement to allow an open competitive tender process to take place in Summer 2026.",Find a Tender,https://www.find-tender.service.gov.uk/Notice/032612-2026
032611-2026,Contract Details Notice for 8075485 call off from Parliamentary Framework,Natural Resources Wales,,,"award, contract",2026-04-09T17:28:04+01:00,UK7 Contract Details Notice for 8075485 call off from Parliamentary Framework,Find a Tender,https://www.find-tender.service.gov.uk/Notice/032611-2026
032610-2026,TechBridge Investment Accelerator Phase 3,Department for Business & Trade,,,"award, contract",2026-04-09T17:27:16+01:00,The Department for Business and Trade (DBT) have procured professional services to select high-potential Ukrainian tech SMEs seeking to expand to the UK and provide them with a programme of virtual and in-person training to improve their entrepreneurial skills and improve the opportunity for the SMEs to raise UK investment.,Find a Tender,https://www.find-tender.service.gov.uk/Notice/032610-2026
032609-2026,Preconstruction Design Services for Sprinkler Upgrade to Industria Building,BE FIRST (REGENERATION) LTD.,2230800,"71300000, 71500000",tender,2026-04-09T17:26:10+01:00,"Development of design of sprinkler upgrade works to Industria Building in Barking. This work is required to bring the sprinkler system in line with HHS requirements and to allow storage of goods at height.
Design indicative guidance has been supplied within the tender documentation, alongside an indicative programme, and pricing schedule.",Find a Tender,https://www.find-tender.service.gov.uk/Notice/032609-2026
032608-2026,Ceredigion - Peripatetic Family Support,Cyngor Sir Ceredigion County Council,157500.0,"85300000, 98000000, 85000000",tender,2026-04-09T17:21:23+01:00,Ceredigion County Council invites suitably qualified service providers to submit to deliver a Preventative Family Support (families with children aged 0-11 years): Peripatetic 1:1 support in the home and the community.,Find a Tender,https://www.find-tender.service.gov.uk/Notice/032608-2026
032607-2026,Beach Management Framework,Environment Agency,,,"award, contract",2026-04-09T17:19:21+01:00,"The Environment Agency requires a Beach Management Framework to deliver its routine and ad-hoc beach maintenance works across all coastal frontages in England that it is responsible for. This maintenance typically consists of moving/transporting large volumes of shingle from areas of accretion to areas of erosion and evenly re-distributing shingle along the sea to restore/maintain the required standard of protection.
There is a requirement to import marine dredged or land-based shingle onto coastal frontages to replenish lost material and to conduct maintenance/repairs to coastal defences and structures. There is a requirement to import and place rock on coastal frontages, as well as to provide coastal incident response, recovery and readiness support in the event of extreme weather events. This maintenance is essential to minimise the risk of coastal flooding to residential properties and commercial businesses.",Find a Tender,https://www.find-tender.service.gov.uk/Notice/032607-2026
032606-2026,"The Provision of a Mental Health Service for Children and Young People (CYP) with Learning Disability and/or Autism, including Mental Health Support Teams (MHST) Supporting CYP with Special Educational Needs and Disabilities (SEND)",Hertfordshire County Council,,85000000,tenderUpdate,2026-04-09T17:19:17+01:00,"Specialist Mental Health Service for Children & Young People (CYP) with a Learning Disability and/or who are autistic.
The service supports the mental health needs of CYP who have complex needs and present with significant communication challenges, as a result of their Learning Disability and or autism that require specialist approaches to mental health support. These often do not appear in isolation and many of CYP will experience co-occurring difficulties, such as:
•	Emotional dysregulation
•	Behaviours of concern[2] (includes CYP with LD and/or ASD that may show behaviours of concern that seem unrelated to mental health at first but underlying mental health needs often become clearer once support begins)
•	Sleep difficulties, feeding difficulties, and toileting difficulties
•	Withdrawal from usual activities significantly impacting activities of daily living (ADL) 
•	Sensory processing difficulties 
In addition, Mental Health Support Teams (MHSTs) provide early help mental health support for pupils (reception to year 13*) with mild to moderate difficulties who are on roll at education settings within Hertfordshire.",Find a Tender,https://www.find-tender.service.gov.uk/Notice/032606-2026
032605-2026,Cleaning of Council  Vehicles and Waste Receptacles,London Borough of Barnet,310000.0,"90917000, 90918000",tender,2026-04-09T17:18:35+01:00,"The London Borough of Barnet require a cleaning service to wash the Council’s fleet vehicles and plant, food waste bins within our town centres and ad-hoc washing of containers in different sizes within the borough.
The cleaning service will be divided into 2 LOTS 
LOT 1 Vehicle, Plant and Equipment Washing
LOT 2 Container Washing Services - Regular, scheduled washing of town centre food waste bins and Ad-hoc washing services for all container types and waste streams
Vehicle, Plant and Equipment Washing 
The London Borough of Barnet requires a supplier to deliver comprehensive vehicle washing and cleaning services for its mixed fleet of operational vehicles and plant.
The services include routine, periodic and ad hoc washing for light and heavy vehicles including, refuse collection vehicles, sweepers, winter maintenance gritters, buses and tippers, and preparation of vehicles for MOT and chassis inspections to DVSA standards. Volumes and frequencies are indicative and may vary throughout the contract to reflect operational requirements.
Services will be delivered primarily from the Council’s wash bay facilities at Oakleigh Road Depot. The supplier is responsible for providing all labour, cleaning materials, equipment and PPE, and must comply with all health and safety, environmental, and COSHH regulations. 
Container Washing 
Barnet provides a range of containers of varying types and sizes for the collection of general waste, food waste, recycling, and garden waste. This service requirement covers the washing and cleaning of waste containers used across the borough.
The bin washing service will include:
•Scheduled washing of all town centre food waste bins, and
•An ad-hoc washing service for containers of various sizes, ranging from 200 litre's to 1,100 litre's, and across all waste streams (general waste, recycling, and food waste).
There is a statutory requirement for all Local Authorities in England to implement separate collections of food waste and recycling across all residential property types. To meet this obligation, the council has installed a number of communal food waste bins across the borough, predominantly serving flatted properties within town centres. These bins require cleaning in accordance with an agreed schedule to maintain hygiene standards and operational efficiency.
For more information about this opportunity, please visit the eSourcing portal at: 
https://londonbarnet.delta-esourcing.com/tenders/UK-UK-London:-Cleaning-services-of-transport-equipment./Z7B28H6944
To respond to this opportunity, please click here: 
https://londonbarnet.delta-esourcing.com/respond/Z7B28H6944",Find a Tender,https://www.find-tender.service.gov.uk/Notice/032605-2026
032604-2026,PSR Direct Award C - CYPS CNE,"Cumbria, Northumberland, Tyne and Wear NHS Foundation Trust",,85100000,tenderUpdate,2026-04-09T17:18:02+01:00,The provision of Counselling services to CYPS Newcastle & Gateshead,Find a Tender,https://www.find-tender.service.gov.uk/Notice/032604-2026
032603-2026,County Wide Grounds Maintenance Services,Buckinghamshire Council,19800000,77314000,tender,2026-04-09T17:15:50+01:00,"The Council invites you to submit a competitive tender to supply grounds maintenance, play area inspection and maintenance and Green Space services, as described in this tender pack. The successful Tenderer will have the expertise to, and the experience of, supplying and continually improving grounds maintenance, play area inspection and maintenance and Green Space services. The results of the services it will provide will have a significant influence on the attractiveness and effectiveness of public spaces and facilities.
This Green Space Contract will take the form of a contract between Wycombe District Council (WDC) and the appointed contractor. The contract is based predominantly on an Output Specification and contract arrangements are as set out in the tender documents. Tenderers are invited to confirm contract management arrangements in their responses to the Specification.
The Council is seeking proposals for the provision of Green Spaces services by means of a public tender exercise, seeking expressions of interest from potential providers for the provision of Green Space Services covering grounds maintenance within the urban areas of Buckinghamshire, Play area inspection & maintenance throughout the Buckinghamshire area and other green space services for Buckinghamshire Council; including allotment and cemetery management, pitch bookings ,changing room management, and general green space enquiry and complaint handling .
Contract summary:
•	Grass Maintenance
•	Hedge Maintenance
•	Shrub/Rose Bed Maintenance
•	Woodland Management and Maintenance
•	Hardstanding Maintenance and parking
•	Winter Weather Work -gritting and snow clearance
•	Litter Collection
•	Play Area Inspection and Maintenance
•	Changing Room Facilities
•	Exterior Furniture Maintenance
•	Bye-law Enforcement
•	Allotment Services Management
•	Pitch Bookings and Income Collection
•	Cemeteries provision including burials.
•	All other Non-Routine Works
•	Maintenance of the soft landscape within Parking areas
The contract will be for an initial term of 5 years, commencing on 1st of January 2027 and ending on 31st December 2031. There will be an option for the Council to extend for a period, or series of periods, up to a maximum of 48 (forty-eight) additional months, making a potential total contract length of 9 years. The total contract spend for the full 9 years is estimated at between £18,000,000 and £19,800,000. This range is only an estimate, and the actual spend maybe higher or lower than these figures. 
The Council is of the opinion that TUPE will apply. The TUPE actuary report is currently not available but will be sent as soon as it is available to the bidders that have returned the confidentiality agreement. This document will be sent via the correspondence function.
The contract will not be divided into Lots. The reason for not having Lots is that we have previously considered fractionalizing the tender into lots, however had moved away from this direction. The reason for this is that we have a business need for a single contract, with one main contact and oversight presiding over the whole, which would reduce our management time and pick up economies of scale throughout the supply chain. We have previously found that one point of contact overall with several area managers gives us a suitable and timely service response, with resilience provided through the area managers.
The Invitation to tender documents for this opportunity are published on the Council's procurement portal: https://in-tendhost.co.uk/buckinghamshire-council If you wish to participate and have not yet registered, please ensure you do so via the procurement portal in order to access the documentation. Tenders must be returned via the Council's procurement portal. The tender return date is midday on Tuesday 12th May 2026. Tenders received after this time and date will not be accepted.",Find a Tender,https://www.find-tender.service.gov.uk/Notice/032603-2026
032602-2026,Water Chemical Treatment HGH,Northumbria Healthcare Facilities Management,,,"award, contract",2026-04-09T17:09:32+01:00,Chilled and heating water treatment and monitoring of water system,Find a Tender,https://www.find-tender.service.gov.uk/Notice/032602-2026
032601-2026,Level 2 Oral Surgery with sedation - Hertfordshire Goffs Oak 26/29,NHS Hertfordshire and West Essex Integrated Care Board,,85130000,tenderUpdate,2026-04-09T17:03:52+01:00,"Level Two Oral Surgery service provides dental treatment to patients which is beyond the scope of general dental practitioners and is performed by practitioners who have completed a clinical accreditation process led by the East of England Regional Chief Dental Officers and the Oral Surgery Managed Clinical Networks.  This service also provides sedation as part of the course of treatment where appropriate.<br/><br/>To confirm as per the PSR direct award process C, the existing provider satisfies the existing contract, delivering a good service, meeting all the KPIs with no quality concerns and good outcomes.  No concerns have been raised by patients and the current contracting arrangements are not changing from the existing contract.",Find a Tender,https://www.find-tender.service.gov.uk/Notice/032601-2026
032600-2026,Air Warfare Education and Training (AWE&T) Capability,Ministry of Defence,,,"award, contract",2026-04-09T16:57:29+01:00,"The Contractor will be required to deliver Air Warfare Education and Training (AWE&T) capability for the Ukrainian Air Force (UkrAF) on behalf of the Authority, as follows:
Air Tactics and Planning Course – Training Objectives, Development and Delivery
Electronic Warfare Training – Training Objectives, Development and Delivery 
The future contract will facilitate the delivery of approximately 20 weeks of training per year.",Find a Tender,https://www.find-tender.service.gov.uk/Notice/032600-2026
032599-2026,Chair support services in relation to Maternity Reviews,Department of Health & Social Care,,,"award, contract",2026-04-09T16:53:54+01:00,"Services required to support Maternity reviews. Including, but not limited to, administrative support, reports, case management, project management, provision of experts and specialist advice",Find a Tender,https://www.find-tender.service.gov.uk/Notice/032599-2026
032598-2026,Export Support,West Midlands Combined Authority,2126250.0,79400000,tenderUpdate,2026-04-09T16:53:08+01:00,"The Export Support Programme aims to support high-growth businesses in the West Midlands (WM) manage their exporting activity more sustainably, to increase the pace of growth and its duration. It will do this through a range of potential interventions including, but not limited to, intensive one-to-one coaching, peer-to-peer support, and workshops.
Initial contract period is for September 2026 - March 2027.
x2 additional 12-month extension options for:
1st April 2027 - 31st March 2028
1st April 2028 - 31st March 2029",Find a Tender,https://www.find-tender.service.gov.uk/Notice/032598-2026
032597-2026,H0849 - Contract for Cadaveric Surgical Skills Training,Health Education and Improvement Wales (HEIW),,,"award, contract",2026-04-09T16:50:45+01:00,"Health Education and Improvement Wales (HEIW) intends to award a contract to Doctors Academy for the provision of cadaveric teaching for surgical skills training. The proposed contract will cover the supply of cadavers and associated anatomy facilities, mortuary services, consumables, equipment, and administrative support required to deliver specialist cadaver‑based surgical education for trainees in Wales.
This award is intended to support the continuation of a bespoke cadaveric training programme developed by HEIW and the School of Surgery, addressing reduced clinical exposure resulting from changes in surgical training pathways and the impact of the COVID‑19 pandemic. Cadaveric teaching is recognised as an essential component of surgical skills development and curriculum delivery.
The proposed award is being pursued via a Single Tender Action due to the highly specialised and regulated nature of cadaveric services, including licensing, storage, and anatomy facility requirements, which are only available through Doctors Academy in Wales. Awarding this contract will ensure continuity of training provision, deliver value for money, and avoid significant financial and logistical burdens that would otherwise fall on surgical trainees if required to access equivalent services outside Wales.",Find a Tender,https://www.find-tender.service.gov.uk/Notice/032597-2026
032596-2026,SEND,Surrey County Council,,60000000,"award, contract",2026-04-09T16:50:13+01:00,SEND,Find a Tender,https://www.find-tender.service.gov.uk/Notice/032596-2026
032595-2026,2024-133 RIIO-3 Independent Technical Adviser,Ofgem,20833333,"71310000, 71621000",tenderUpdate,2026-04-09T16:50:03+01:00,"Ofgem is seeking to appoint up to three organisations to fulfil the role of Independent Technical Adviser (ITA) as part of a framework agreement. The ITA will be an independent body responsible for providing assurance to Ofgem on the design, procurement, cost and overall delivery of selected load‑related projects across all electricity Transmission Owners (TOs). The objective of ITA assurance is to support enhanced and accelerated regulatory decision‑making and processes.
Further information can be found in the attached ITT document.",Find a Tender,https://www.find-tender.service.gov.uk/Notice/032595-2026
